{
  "witnessSchema": 1,
  "profile": "full",
  "result": "rejected",
  "failures": [
    {
      "witnessId": "z-last",
      "class": "stability_failure",
      "lawRef": "GATE-3.1",
      "message": "out of order"
    },
    {
      "witnessId": "a-first",
      "class": "locality_failure",
      "lawRef": "GATE-3.2",
      "message": "should sort before stability"
    }
  ]
}
